{
  "$schema": "https://json-schema.org/draft/2020-12/schema",
  "$id": "https://vexil-lang.org/release/history/ratifications/history-ratification-repository-administrator-2026-07-23.json",
  "version": "1.0",
  "recordKind": "historical-tag-baseline-ratification",
  "ratificationId": "history-ratification-repository-administrator-2026-07-23",
  "roleId": "repository-administrator",
  "actorId": "github:furkanmamuk",
  "baselineDigest": "sha256:efe729a7e80b70e13cf1996657e547b38f513955437f4cd8af9aafb9cdf698d8",
  "observationScope": "https://github.com/vexil-lang/vexil.git | git ls-remote --tags | 2026-07-23T13:15:47Z",
  "approvedAt": "2026-07-23T13:31:20Z"
}
